domain,dataset,problem_id,problem_key,run_index,is_correct,parse_ok,think_chars,think_total_chars,raw_knot_present,raw_knot_severity,raw_primary_trigger,raw_trace_strategy,raw_reversal_count,raw_state_consistency,raw_recovers_later,raw_annotator_confidence,raw_knot_quote,raw_open_diagnosis,raw_knot_symptoms,protocol_filter,knot_present,knot_present_bin,knot_severity,primary_trigger,trace_strategy,reversal_count,state_consistency,recovers_later,annotator_confidence,knot_quote,open_diagnosis,knot_symptoms,knot_count,sym_case_split_instability,sym_assumption_drift,sym_subgoal_frame_loss,sym_variable_binding_drift,sym_invariant_drift,sym_repair_without_recovery
math,aime25,28,aime25:28,54,1,1,15619,44889,no,0.0,none,symbolic_manipulation,0.0,stable,no,high,,"The reasoning provided is consistent and maintains a stable control of the active assumptions, cases, symbols, subgoals, and invariants throughout the trace.",none,raw_no,no,0,0,none,symbolic_manipulation,0.0,stable,no,high,,"The reasoning provided is consistent and maintains a stable control of the active assumptions, cases, symbols, subgoals, and invariants throughout the trace.",none,0,0,0,0,0,0,0
math,aime25,28,aime25:28,58,1,1,15618,63483,no,0.0,none,symbolic_manipulation,0.0,stable,no,high,,"The reasoning provided is consistent and maintains a stable control of the active assumptions, cases, symbols, subgoals, and invariants throughout the trace.",none,raw_no,no,0,0,none,symbolic_manipulation,0.0,stable,no,high,,"The reasoning provided is consistent and maintains a stable control of the active assumptions, cases, symbols, subgoals, and invariants throughout the trace.",none,0,0,0,0,0,0,0
math,aime25,3,aime25:3,2,1,1,15619,33178,no,0.0,none,symbolic_manipulation,0.0,stable,no,high,,The reasoning is consistent and follows a logical path without any breaks in the active state.,none,raw_no,no,0,0,none,symbolic_manipulation,0.0,stable,no,high,,The reasoning is consistent and follows a logical path without any breaks in the active state.,none,0,0,0,0,0,0,0
math,aime25,3,aime25:3,9,0,1,15619,84915,yes,2.0,symbol_binding,symbolic_manipulation,1.0,recovered_break,yes,medium,But |y| is a bit messy because it depends on the sign of y.,"The model struggles with the variable binding for |y|, leading to confusion and multiple repairs without a clear resolution.",variable_binding_drift|repair_without_recovery,accepted_math,yes,1,2,symbol_binding,symbolic_manipulation,1.0,recovered_break,yes,medium,But |y| is a bit messy because it depends on the sign of y.,"The model struggles with the variable binding for |y|, leading to confusion and multiple repairs without a clear resolution.",variable_binding_drift|repair_without_recovery,2,0,0,0,1,0,1
math,aime25,3,aime25:3,28,1,1,15619,49110,no,0.0,none,symbolic_manipulation,0.0,stable,no,high,,"The model's reasoning is consistent and maintains a stable control of the active assumptions, cases, symbols, subgoals, and invariants throughout the provided text.",none,raw_no,no,0,0,none,symbolic_manipulation,0.0,stable,no,high,,"The model's reasoning is consistent and maintains a stable control of the active assumptions, cases, symbols, subgoals, and invariants throughout the provided text.",none,0,0,0,0,0,0,0
math,aime25,3,aime25:3,32,0,1,15619,81185,yes,2.0,symbol_binding,case_analysis,1.0,recovered_break,yes,medium,"Now, this has |y|, which depends on the sign of y, so I need to consider cases when y is positive and when y is negative.","The model initially introduces |y| as dependent on the sign of y, leading to a case split. However, it later revisits the equation without re-introducing the case split, causing a variable binding drift. The model recovers by re-introducing the case split.",variable_binding_drift|repair_without_recovery,accepted_math,yes,1,2,symbol_binding,case_analysis,1.0,recovered_break,yes,medium,"Now, this has |y|, which depends on the sign of y, so I need to consider cases when y is positive and when y is negative.","The model initially introduces |y| as dependent on the sign of y, leading to a case split. However, it later revisits the equation without re-introducing the case split, causing a variable binding drift. The model recovers by re-introducing the case split.",variable_binding_drift|repair_without_recovery,2,0,0,0,1,0,1
math,aime25,6,aime25:6,2,0,1,15618,98404,yes,2.0,assumption_tracking,symbolic_manipulation,1.0,recovered_break,yes,medium,"Now, the last word contains G, meaning that in the last word, which has the largest X, and it contains G, so either X or Y is G, but since X is the smaller one, and Y is the larger one, but G could be either.","The model drifts from the assumption that G must be the smaller letter in the pair to the possibility that G could be either the smaller or larger letter, without immediately correcting this assumption.",assumption_drift|repair_without_recovery,accepted_math,yes,1,2,assumption_tracking,symbolic_manipulation,1.0,recovered_break,yes,medium,"Now, the last word contains G, meaning that in the last word, which has the largest X, and it contains G, so either X or Y is G, but since X is the smaller one, and Y is the larger one, but G could be either.","The model drifts from the assumption that G must be the smaller letter in the pair to the possibility that G could be either the smaller or larger letter, without immediately correcting this assumption.",assumption_drift|repair_without_recovery,2,0,1,0,0,0,1
math,aime25,6,aime25:6,10,0,1,15618,111791,yes,2.0,assumption_tracking,symbolic_manipulation,1.0,recovered_break,yes,medium,"Now, the last word is the one with the largest min letter. But it's not necessarily the pair with the largest min, because multiple pairs could have the same min letter, but since all letters are distinct, the min letters are all distinct, so no ties.","The model drifts from the assumption that the last word is determined by the largest min letter and then corrects itself, but the instability remains for a moment.",assumption_drift|repair_without_recovery,accepted_math,yes,1,2,assumption_tracking,symbolic_manipulation,1.0,recovered_break,yes,medium,"Now, the last word is the one with the largest min letter. But it's not necessarily the pair with the largest min, because multiple pairs could have the same min letter, but since all letters are distinct, the min letters are all distinct, so no ties.","The model drifts from the assumption that the last word is determined by the largest min letter and then corrects itself, but the instability remains for a moment.",assumption_drift|repair_without_recovery,2,0,1,0,0,0,1
math,aime25,6,aime25:6,18,1,1,15619,81388,yes,2.0,symbol_binding,symbolic_manipulation,1.0,recovered_break,yes,medium,"Each word has two letters, so for example, a word like AB has first letter A, but another word might have first letter A if it's, say, A something, but no, because letter A can only be in one word, so each letter appears in exactly one word, so the first letters of the six words are six distinct letters? No.","The model's reasoning about the distinctness of the first letters of the words is inconsistent with the alphabetical sorting rule, leading to a variable binding drift. The model later corrects this by acknowledging that the first letters are determined by the smaller of the two letters in the pair.",variable_binding_drift|repair_without_recovery,accepted_math,yes,1,2,symbol_binding,symbolic_manipulation,1.0,recovered_break,yes,medium,"Each word has two letters, so for example, a word like AB has first letter A, but another word might have first letter A if it's, say, A something, but no, because letter A can only be in one word, so each letter appears in exactly one word, so the first letters of the six words are six distinct letters? No.","The model's reasoning about the distinctness of the first letters of the words is inconsistent with the alphabetical sorting rule, leading to a variable binding drift. The model later corrects this by acknowledging that the first letters are determined by the smaller of the two letters in the pair.",variable_binding_drift|repair_without_recovery,2,0,0,0,1,0,1
math,aime25,6,aime25:6,62,1,1,15618,91571,no,0.0,none,symbolic_manipulation,0.0,stable,no,high,,The reasoning is consistent and maintains a stable active state throughout.,none,raw_no,no,0,0,none,symbolic_manipulation,0.0,stable,no,high,,The reasoning is consistent and maintains a stable active state throughout.,none,0,0,0,0,0,0,0
math,aime25,7,aime25:7,10,0,1,15620,84218,yes,2.0,symbol_binding,symbolic_manipulation,1.0,recovered_break,yes,medium,The vector from A to B is B - A = (3i - k) - (4 + k) = -4 - 2k + 3i.,"The model incorrectly calculates the vector from A to B, leading to a variable binding drift. This is later corrected, but the instability in the calculation is a moderate break.",variable_binding_drift|repair_without_recovery,accepted_math,yes,1,2,symbol_binding,symbolic_manipulation,1.0,recovered_break,yes,medium,The vector from A to B is B - A = (3i - k) - (4 + k) = -4 - 2k + 3i.,"The model incorrectly calculates the vector from A to B, leading to a variable binding drift. This is later corrected, but the instability in the calculation is a moderate break.",variable_binding_drift|repair_without_recovery,2,0,0,0,1,0,1
math,aime25,7,aime25:7,17,0,1,15620,94006,yes,2.0,assumption_tracking,symbolic_manipulation,1.0,recovered_break,yes,medium,"The equation |z - 4 - k| = |z - 3i - k| means that z is on the perpendicular bisector of the segment joining a and b. ... But the perpendicular bisector is a line, and for them to intersect at exactly one point, it must be tangent to the circle.","The model drifts from the assumption that the perpendicular bisector must be tangent to the circle to find a single intersection point, then later corrects this assumption without fully clarifying the reasoning.",assumption_drift|repair_without_recovery,accepted_math,yes,1,2,assumption_tracking,symbolic_manipulation,1.0,recovered_break,yes,medium,"The equation |z - 4 - k| = |z - 3i - k| means that z is on the perpendicular bisector of the segment joining a and b. ... But the perpendicular bisector is a line, and for them to intersect at exactly one point, it must be tangent to the circle.","The model drifts from the assumption that the perpendicular bisector must be tangent to the circle to find a single intersection point, then later corrects this assumption without fully clarifying the reasoning.",assumption_drift|repair_without_recovery,2,0,1,0,0,0,1
math,aime25,7,aime25:7,22,1,1,15618,57097,yes,2.0,symbol_binding,symbolic_manipulation,1.0,recovered_break,yes,medium,"In the problem, it's written as |z - 4 - k|, which is |z - (4 + k)|, yes, same as I had. But in the text, it's written as '4 - k', no, in the original: '|z - 4 - k| = |z - 3i - k|'.","The model misinterpreted the problem statement, mistaking '4 - k' for '4 + k', leading to a variable binding drift. This was later corrected.",variable_binding_drift|repair_without_recovery,accepted_math,yes,1,2,symbol_binding,symbolic_manipulation,1.0,recovered_break,yes,medium,"In the problem, it's written as |z - 4 - k|, which is |z - (4 + k)|, yes, same as I had. But in the text, it's written as '4 - k', no, in the original: '|z - 4 - k| = |z - 3i - k|'.","The model misinterpreted the problem statement, mistaking '4 - k' for '4 + k', leading to a variable binding drift. This was later corrected.",variable_binding_drift|repair_without_recovery,2,0,0,0,1,0,1
math,aime25,7,aime25:7,23,1,1,15619,50214,no,0.0,none,symbolic_manipulation,0.0,stable,no,high,,"The model's reasoning is consistent and maintains a stable control of the active assumptions, cases, symbols, subgoals, and invariants throughout the provided text.",none,raw_no,no,0,0,none,symbolic_manipulation,0.0,stable,no,high,,"The model's reasoning is consistent and maintains a stable control of the active assumptions, cases, symbols, subgoals, and invariants throughout the provided text.",none,0,0,0,0,0,0,0
math,aime25,8,aime25:8,7,0,1,15618,66421,yes,2.0,symbol_binding,symbolic_manipulation,1.0,recovered_break,yes,medium,"So, for the rotated curve, we have: y = -\frac{\sqrt{3}}{2} x' + \frac{1}{2} y' \nAnd this point (x, y) must satisfy the original parabola equation: y = x^2 - 4. \nSo, for the rotated curve, we have: y = -\frac{\sqrt{3}}{2} x' + \frac{1}{2} y' \nAnd y = x^2 - 4, so: \n-\frac{\sqrt{3}}{2} x' + \frac{1}{2} y' = \left( \frac{1}{2} x' + \frac{\sqrt{3}}{2} y' \right)^2 - 4","The model attempts to equate the y-coordinate of the rotated parabola to the original parabola's equation, but the variable x' is not properly defined in terms of x and y. This leads to a confusion in variable binding and requires a correction to properly express the rotated curve in terms of the original coordinates.",variable_binding_drift|repair_without_recovery,accepted_math,yes,1,2,symbol_binding,symbolic_manipulation,1.0,recovered_break,yes,medium,"So, for the rotated curve, we have: y = -\frac{\sqrt{3}}{2} x' + \frac{1}{2} y' \nAnd this point (x, y) must satisfy the original parabola equation: y = x^2 - 4. \nSo, for the rotated curve, we have: y = -\frac{\sqrt{3}}{2} x' + \frac{1}{2} y' \nAnd y = x^2 - 4, so: \n-\frac{\sqrt{3}}{2} x' + \frac{1}{2} y' = \left( \frac{1}{2} x' + \frac{\sqrt{3}}{2} y' \right)^2 - 4","The model attempts to equate the y-coordinate of the rotated parabola to the original parabola's equation, but the variable x' is not properly defined in terms of x and y. This leads to a confusion in variable binding and requires a correction to properly express the rotated curve in terms of the original coordinates.",variable_binding_drift|repair_without_recovery,2,0,0,0,1,0,1
math,aime25,8,aime25:8,40,0,1,15619,65735,no,0.0,none,symbolic_manipulation,0.0,stable,no,high,,"The reasoning provided is consistent and maintains a stable control of the active assumptions, cases, symbols, subgoals, and invariants throughout the trace.",none,raw_no,no,0,0,none,symbolic_manipulation,0.0,stable,no,high,,"The reasoning provided is consistent and maintains a stable control of the active assumptions, cases, symbols, subgoals, and invariants throughout the trace.",none,0,0,0,0,0,0,0
math,aime25,8,aime25:8,42,1,1,15620,24795,no,0.0,none,symbolic_manipulation,0.0,stable,no,high,,"The reasoning provided is consistent and maintains a stable control of the active assumptions, cases, symbols, subgoals, and invariants throughout the trace.",none,raw_no,no,0,0,none,symbolic_manipulation,0.0,stable,no,high,,"The reasoning provided is consistent and maintains a stable control of the active assumptions, cases, symbols, subgoals, and invariants throughout the trace.",none,0,0,0,0,0,0,0
math,aime25,8,aime25:8,58,1,1,15618,41841,no,0.0,none,symbolic_manipulation,0.0,stable,no,high,,The reasoning provided is consistent and maintains a stable control over the active assumptions and symbols throughout the trace.,none,raw_no,no,0,0,none,symbolic_manipulation,0.0,stable,no,high,,The reasoning provided is consistent and maintains a stable control over the active assumptions and symbols throughout the trace.,none,0,0,0,0,0,0,0
math,aime25,9,aime25:9,8,1,1,15618,90623,no,0.0,none,symbolic_manipulation,0.0,stable,no,high,,"The reasoning provided is consistent and maintains a stable control of the active assumptions, cases, symbols, subgoals, and invariants throughout.",none,raw_no,no,0,0,none,symbolic_manipulation,0.0,stable,no,high,,"The reasoning provided is consistent and maintains a stable control of the active assumptions, cases, symbols, subgoals, and invariants throughout.",none,0,0,0,0,0,0,0
math,aime25,9,aime25:9,28,0,1,15618,118380,yes,2.0,assumption_tracking,symbolic_manipulation,1.0,recovered_break,yes,medium,"Each row is a permutation of 1-9, and each vertical 3x3 block has each number once. But since the vertical blocks are columns 1-3, 4-6, 7-9, and each must have each number once, that means that for each position in the column, but wait no.","The model drifts from the assumption of each row being a permutation and each block containing all numbers once, and then attempts to correct by introducing a new assumption without immediately clarifying the relationship between the two.",assumption_drift|subgoal_frame_loss,accepted_math,yes,1,2,assumption_tracking,symbolic_manipulation,1.0,recovered_break,yes,medium,"Each row is a permutation of 1-9, and each vertical 3x3 block has each number once. But since the vertical blocks are columns 1-3, 4-6, 7-9, and each must have each number once, that means that for each position in the column, but wait no.","The model drifts from the assumption of each row being a permutation and each block containing all numbers once, and then attempts to correct by introducing a new assumption without immediately clarifying the relationship between the two.",assumption_drift|subgoal_frame_loss,2,0,1,1,0,0,0
math,aime25,9,aime25:9,55,0,1,15617,122113,yes,2.0,assumption_tracking,symbolic_manipulation,0.0,lost_state,no,medium,"Each row has 9 cells, and must contain numbers 1-9 each exactly once, since it says 'each row contains 9 different numbers' and there are 9 numbers.",The model drifts from the assumption that each row must contain 9 different numbers to a variable binding issue without correcting the assumption.,assumption_drift|variable_binding_drift,accepted_math,yes,1,2,assumption_tracking,symbolic_manipulation,0.0,lost_state,no,medium,"Each row has 9 cells, and must contain numbers 1-9 each exactly once, since it says 'each row contains 9 different numbers' and there are 9 numbers.",The model drifts from the assumption that each row must contain 9 different numbers to a variable binding issue without correcting the assumption.,assumption_drift|variable_binding_drift,2,0,1,0,1,0,0
math,aime25,9,aime25:9,58,1,1,15619,102101,yes,2.0,symbol_binding,symbolic_manipulation,1.0,recovered_break,yes,medium,"Each row, in the three columns, has three distinct numbers, and there are three rows, and the block must have all nine numbers, so the union of the three sets (each set being the three numbers in the three columns for one row) must be all nine numbers, and since each set has three distinct numbers, and total nine, they must be pairwise disjoint and cover all numbers.","The model's reasoning about the disjointness of the sets within the 3x3 blocks becomes unstable and is not immediately corrected, leading to confusion about the necessary conditions for the blocks to contain all numbers.",variable_binding_drift|repair_without_recovery,accepted_math,yes,1,2,symbol_binding,symbolic_manipulation,1.0,recovered_break,yes,medium,"Each row, in the three columns, has three distinct numbers, and there are three rows, and the block must have all nine numbers, so the union of the three sets (each set being the three numbers in the three columns for one row) must be all nine numbers, and since each set has three distinct numbers, and total nine, they must be pairwise disjoint and cover all numbers.","The model's reasoning about the disjointness of the sets within the 3x3 blocks becomes unstable and is not immediately corrected, leading to confusion about the necessary conditions for the blocks to contain all numbers.",variable_binding_drift|repair_without_recovery,2,0,0,0,1,0,1
math,brumo25,brumo25-0,brumo25:brumo25-0,2,1,1,15620,36505,yes,2.0,assumption_tracking,symbolic_manipulation,1.0,recovered_break,yes,medium,"But are the triangles similar? Probably not, because each triangle is defined with respect to the next circle.","The model initially doubts the similarity of the triangles but later confirms it, indicating an assumption drift and subsequent repair without recovery.",assumption_drift|repair_without_recovery,accepted_math,yes,1,2,assumption_tracking,symbolic_manipulation,1.0,recovered_break,yes,medium,"But are the triangles similar? Probably not, because each triangle is defined with respect to the next circle.","The model initially doubts the similarity of the triangles but later confirms it, indicating an assumption drift and subsequent repair without recovery.",assumption_drift|repair_without_recovery,2,0,1,0,0,0,1
math,brumo25,brumo25-0,brumo25:brumo25-0,40,1,1,15618,40852,yes,2.0,assumption_tracking,symbolic_manipulation,1.0,recovered_break,yes,medium,"Assume the circles are getting smaller as n increases. C_1 has radius 1, and we're going to C_100, so probably the radii are decreasing.","The model initially assumes the radii are decreasing but later revises this assumption without a clear explanation, leading to confusion.",assumption_drift|repair_without_recovery,accepted_math,yes,1,2,assumption_tracking,symbolic_manipulation,1.0,recovered_break,yes,medium,"Assume the circles are getting smaller as n increases. C_1 has radius 1, and we're going to C_100, so probably the radii are decreasing.","The model initially assumes the radii are decreasing but later revises this assumption without a clear explanation, leading to confusion.",assumption_drift|repair_without_recovery,2,0,1,0,0,0,1
math,brumo25,brumo25-0,brumo25:brumo25-0,47,0,1,15618,50830,yes,2.0,assumption_tracking,symbolic_manipulation,1.0,recovered_break,yes,medium,"Assume the center is O. Cn has radius rn, so it's centered at O with radius rn. Now, there is an equilateral triangle with vertices on C_{n+1}, so each vertex is at distance r_{n+1} from O.","The model drifts from the assumption of concentric circles and the fixed center O, leading to a confusion about the radii of the circles and the vertices of the triangles. This is later corrected by revisiting the concentric circle assumption.",assumption_drift|repair_without_recovery,accepted_math,yes,1,2,assumption_tracking,symbolic_manipulation,1.0,recovered_break,yes,medium,"Assume the center is O. Cn has radius rn, so it's centered at O with radius rn. Now, there is an equilateral triangle with vertices on C_{n+1}, so each vertex is at distance r_{n+1} from O.","The model drifts from the assumption of concentric circles and the fixed center O, leading to a confusion about the radii of the circles and the vertices of the triangles. This is later corrected by revisiting the concentric circle assumption.",assumption_drift|repair_without_recovery,2,0,1,0,0,0,1
math,brumo25,brumo25-0,brumo25:brumo25-0,50,0,1,15618,57838,yes,2.0,assumption_tracking,symbolic_manipulation,1.0,recovered_break,yes,medium,"But perhaps the triangle for Cn has vertices on C_n, but the problem says on C_{n+1}.","The model drifts from the assumption that the triangle vertices are on C_n to C_{n+1}, which is later corrected to C_{n-1}. This causes a break in the assumption about the relationship between the circles and triangles.",assumption_drift|repair_without_recovery,accepted_math,yes,1,2,assumption_tracking,symbolic_manipulation,1.0,recovered_break,yes,medium,"But perhaps the triangle for Cn has vertices on C_n, but the problem says on C_{n+1}.","The model drifts from the assumption that the triangle vertices are on C_n to C_{n+1}, which is later corrected to C_{n-1}. This causes a break in the assumption about the relationship between the circles and triangles.",assumption_drift|repair_without_recovery,2,0,1,0,0,0,1
math,brumo25,brumo25-11,brumo25:brumo25-11,4,1,1,15620,85499,no,0.0,none,symbolic_manipulation,0.0,stable,no,high,,The reasoning provided is consistent and maintains a stable active state throughout.,none,raw_no,no,0,0,none,symbolic_manipulation,0.0,stable,no,high,,The reasoning provided is consistent and maintains a stable active state throughout.,none,0,0,0,0,0,0,0
math,brumo25,brumo25-11,brumo25:brumo25-11,23,0,1,15618,112962,yes,2.0,symbol_binding,symbolic_manipulation,1.0,recovered_break,yes,medium,"For each vertex i, the number of vertices at circular distance d is: For d=1,2,3,4: two vertices each, except d=5: one vertex. As above for i=1.","The model drifts in its variable binding, confusing the number of vertices at a given circular distance, and later corrects itself without a clear explanation.",variable_binding_drift|repair_without_recovery,accepted_math,yes,1,2,symbol_binding,symbolic_manipulation,1.0,recovered_break,yes,medium,"For each vertex i, the number of vertices at circular distance d is: For d=1,2,3,4: two vertices each, except d=5: one vertex. As above for i=1.","The model drifts in its variable binding, confusing the number of vertices at a given circular distance, and later corrects itself without a clear explanation.",variable_binding_drift|repair_without_recovery,2,0,0,0,1,0,1
math,brumo25,brumo25-11,brumo25:brumo25-11,28,1,1,15619,83173,no,0.0,none,symbolic_manipulation,0.0,stable,no,high,,"The reasoning provided is consistent and maintains a stable control of the active assumptions, cases, symbols, subgoals, and invariants throughout the trace.",none,raw_no,no,0,0,none,symbolic_manipulation,0.0,stable,no,high,,"The reasoning provided is consistent and maintains a stable control of the active assumptions, cases, symbols, subgoals, and invariants throughout the trace.",none,0,0,0,0,0,0,0
