domain,dataset,problem_id,problem_key,run_index,is_correct,parse_ok,think_chars,think_total_chars,raw_knot_present,raw_knot_severity,raw_primary_trigger,raw_trace_strategy,raw_reversal_count,raw_state_consistency,raw_recovers_later,raw_annotator_confidence,raw_knot_quote,raw_open_diagnosis,raw_knot_symptoms,protocol_filter,knot_present,knot_present_bin,knot_severity,primary_trigger,trace_strategy,reversal_count,state_consistency,recovers_later,annotator_confidence,knot_quote,open_diagnosis,knot_symptoms,knot_count,sym_case_split_instability,sym_assumption_drift,sym_subgoal_frame_loss,sym_variable_binding_drift,sym_invariant_drift,sym_repair_without_recovery
math,aime24,85,aime24:85,30,1,1,15620,70361,yes,2.0,assumption_tracking,symbolic_manipulation,1.0,recovered_break,yes,medium,"Therefore, the hexagon is formed by three pairs of lines cutting the sides of triangle T proportionally. For example, if AB is a side of triangle T, then DE is parallel to AB, cutting the other sides of triangle T. Similarly for the other pairs.","The model drifts from the assumption that the hexagon is formed by cutting the triangle proportionally, which is later corrected but leads to a period of instability in the reasoning.",assumption_drift|repair_without_recovery,accepted_math,yes,1,2,assumption_tracking,symbolic_manipulation,1.0,recovered_break,yes,medium,"Therefore, the hexagon is formed by three pairs of lines cutting the sides of triangle T proportionally. For example, if AB is a side of triangle T, then DE is parallel to AB, cutting the other sides of triangle T. Similarly for the other pairs.","The model drifts from the assumption that the hexagon is formed by cutting the triangle proportionally, which is later corrected but leads to a period of instability in the reasoning.",assumption_drift|repair_without_recovery,2,0,1,0,0,0,1
math,aime24,85,aime24:85,46,0,1,15618,62343,yes,2.0,symbol_binding,symbolic_manipulation,1.0,recovered_break,yes,medium,"Let me denote the triangle as triangle PQR, where P is the intersection of AB and CD, Q is the intersection of CD and EF, and R is the intersection of EF and AB? Wait, but AB, CD, EF are three sides. If you extend them, they might form a triangle. Let me think.","The model initially defines the triangle PQR based on the intersections of sides AB, CD, and EF. However, it later questions whether these intersections are valid, indicating a variable binding drift. The model attempts to recover by considering the extensions of the sides, but this does not fully resolve the instability.",variable_binding_drift|repair_without_recovery,setup_search,no,0,0,none,symbolic_manipulation,1.0,recovered_break,yes,medium,"Let me denote the triangle as triangle PQR, where P is the intersection of AB and CD, Q is the intersection of CD and EF, and R is the intersection of EF and AB? Wait, but AB, CD, EF are three sides. If you extend them, they might form a triangle. Let me think.","The model initially defines the triangle PQR based on the intersections of sides AB, CD, and EF. However, it later questions whether these intersections are valid, indicating a variable binding drift. The model attempts to recover by considering the extensions of the sides, but this does not fully resolve the instability.",none,0,0,0,0,0,0,0
math,aime24,85,aime24:85,49,1,1,15619,89196,yes,2.0,assumption_tracking,symbolic_manipulation,1.0,recovered_break,yes,medium,"Since the hexagon is convex, all the interior angles are less than 180 degrees. Also, since opposite sides are parallel, the hexagon can be thought of as being formed by three pairs of parallel sides.","The model drifts from the assumption that the hexagon is convex and equilateral with opposite sides parallel, which leads to a series of repairs without recovery. The model later revisits the assumption but does not fully correct the initial drift.",assumption_drift|repair_without_recovery,accepted_math,yes,1,2,assumption_tracking,symbolic_manipulation,1.0,recovered_break,yes,medium,"Since the hexagon is convex, all the interior angles are less than 180 degrees. Also, since opposite sides are parallel, the hexagon can be thought of as being formed by three pairs of parallel sides.","The model drifts from the assumption that the hexagon is convex and equilateral with opposite sides parallel, which leads to a series of repairs without recovery. The model later revisits the assumption but does not fully correct the initial drift.",assumption_drift|repair_without_recovery,2,0,1,0,0,0,1
math,aime24,85,aime24:85,53,0,1,15620,85124,yes,2.0,symbol_binding,symbolic_manipulation,3.0,lost_state,no,medium,"Let me denote the triangle formed by the vectors a, b, c as triangle PQR, where P is the intersection of AB and CD extended, Q is the intersection of CD and EF extended, and R is the intersection of EF and AB extended? Wait, maybe not. Wait, AB, CD, EF are three sides. Let me denote the triangle as triangle T with sides 200, 240, 300. Wait, maybe not. Wait, AB, CD, EF are three sides. Let me denote the triangle as triangle T with sides 200, 240, 300.","The model repeatedly changes its notation for the triangle formed by the extensions of AB, CD, and EF, leading to confusion and a loss of the active state. This is indicative of variable binding drift and a lack of repair recovery.",variable_binding_drift|repair_without_recovery,accepted_math,yes,1,2,symbol_binding,symbolic_manipulation,3.0,lost_state,no,medium,"Let me denote the triangle formed by the vectors a, b, c as triangle PQR, where P is the intersection of AB and CD extended, Q is the intersection of CD and EF extended, and R is the intersection of EF and AB extended? Wait, maybe not. Wait, AB, CD, EF are three sides. Let me denote the triangle as triangle T with sides 200, 240, 300. Wait, maybe not. Wait, AB, CD, EF are three sides. Let me denote the triangle as triangle T with sides 200, 240, 300.","The model repeatedly changes its notation for the triangle formed by the extensions of AB, CD, and EF, leading to confusion and a loss of the active state. This is indicative of variable binding drift and a lack of repair recovery.",variable_binding_drift|repair_without_recovery,2,0,0,0,1,0,1
math,aime24,87,aime24:87,13,1,1,15619,43513,yes,2.0,assumption_tracking,symbolic_manipulation,1.0,recovered_break,yes,medium,"Therefore, there is a contradiction here. Therefore, my mistake is that Equations (1), (2), (3) are not sufficient? Or maybe my equations are wrong?","The model drifts from the assumption that the equations derived are sufficient to solve the problem, leading to a contradiction. The model later revisits the equations but does not fully resolve the inconsistency.",assumption_drift|repair_without_recovery,accepted_math,yes,1,2,assumption_tracking,symbolic_manipulation,1.0,recovered_break,yes,medium,"Therefore, there is a contradiction here. Therefore, my mistake is that Equations (1), (2), (3) are not sufficient? Or maybe my equations are wrong?","The model drifts from the assumption that the equations derived are sufficient to solve the problem, leading to a contradiction. The model later revisits the equations but does not fully resolve the inconsistency.",assumption_drift|repair_without_recovery,2,0,1,0,0,0,1
math,aime24,87,aime24:87,16,1,0,15618,58094,,,,,,,,,,,none,raw_no,no,0,0,none,,,,,,,,none,0,0,0,0,0,0,0
math,aime24,87,aime24:87,54,0,1,15618,77285,yes,2.0,assumption_tracking,symbolic_manipulation,1.0,recovered_break,yes,medium,"Therefore, there must be an error in the assumption that A, B, D can be chosen freely based on C. Wait, but how?","The model drifted from the assumption that A, B, D can be chosen freely based on C, leading to a series of repairs without recovery. This caused an instability in the active assumption.",assumption_drift|repair_without_recovery,accepted_math,yes,1,2,assumption_tracking,symbolic_manipulation,1.0,recovered_break,yes,medium,"Therefore, there must be an error in the assumption that A, B, D can be chosen freely based on C. Wait, but how?","The model drifted from the assumption that A, B, D can be chosen freely based on C, leading to a series of repairs without recovery. This caused an instability in the active assumption.",assumption_drift|repair_without_recovery,2,0,1,0,0,0,1
math,aime24,87,aime24:87,55,0,1,15617,69590,yes,2.0,assumption_tracking,symbolic_manipulation,1.0,recovered_break,yes,medium,"Therefore, there must be an error in the derivation. Wait, let me check the equations again.",The model drifts from the original assumption of finding a number that satisfies all conditions and instead focuses on finding an error in the derivation without providing a clear path to recovery.,assumption_drift|repair_without_recovery,accepted_math,yes,1,2,assumption_tracking,symbolic_manipulation,1.0,recovered_break,yes,medium,"Therefore, there must be an error in the derivation. Wait, let me check the equations again.",The model drifts from the original assumption of finding a number that satisfies all conditions and instead focuses on finding an error in the derivation without providing a clear path to recovery.,assumption_drift|repair_without_recovery,2,0,1,0,0,0,1
math,aime24,88,aime24:88,9,1,1,15620,74860,yes,2.0,assumption_tracking,case_analysis,1.0,recovered_break,yes,medium,"Wait, the problem says 'When T rests on the outside of S, it is externally tangent to S along a circle with radius r_i, and when T rests on the outside of S, it is externally tangent to S along a circle with radius r_o.' Wait, that seems like the same condition.","The model drifted from the initial assumption about the conditions of tangency and had to correct itself, indicating an instability in the active assumption.",assumption_drift|repair_without_recovery,accepted_math,yes,1,2,assumption_tracking,case_analysis,1.0,recovered_break,yes,medium,"Wait, the problem says 'When T rests on the outside of S, it is externally tangent to S along a circle with radius r_i, and when T rests on the outside of S, it is externally tangent to S along a circle with radius r_o.' Wait, that seems like the same condition.","The model drifted from the initial assumption about the conditions of tangency and had to correct itself, indicating an instability in the active assumption.",assumption_drift|repair_without_recovery,2,0,1,0,0,0,1
math,aime24,88,aime24:88,29,0,1,15620,105354,yes,2.0,assumption_tracking,symbolic_manipulation,1.0,recovered_break,yes,medium,"The torus is generated by rotating a circle of radius 3 around an axis that's 6 units away from the center of the circle. Wait, the radius of the circle is 3, so the axis is 6 units away? That seems like the axis is twice the radius of the circle.","The model incorrectly assumes the axis is twice the radius of the circle, which leads to a misunderstanding of the torus's geometry. This assumption is later corrected, but it indicates a drift in the active assumption.",assumption_drift|repair_without_recovery,accepted_math,yes,1,2,assumption_tracking,symbolic_manipulation,1.0,recovered_break,yes,medium,"The torus is generated by rotating a circle of radius 3 around an axis that's 6 units away from the center of the circle. Wait, the radius of the circle is 3, so the axis is 6 units away? That seems like the axis is twice the radius of the circle.","The model incorrectly assumes the axis is twice the radius of the circle, which leads to a misunderstanding of the torus's geometry. This assumption is later corrected, but it indicates a drift in the active assumption.",assumption_drift|repair_without_recovery,2,0,1,0,0,0,1
math,aime24,88,aime24:88,37,1,1,15619,82472,yes,2.0,assumption_tracking,symbolic_manipulation,1.0,recovered_break,yes,medium,"Wait, the problem says: ""When T rests on the outside of S, it is externally tangent to S along a circle with radius r_i, and when T rests on the outside of S, it is externally tangent to S along a circle with radius r_o."" Wait, that seems redundant.","The model experiences an assumption drift by questioning the redundancy of the problem statement, which leads to a momentary uncertainty in the active assumption before recovering.",assumption_drift|repair_without_recovery,accepted_math,yes,1,2,assumption_tracking,symbolic_manipulation,1.0,recovered_break,yes,medium,"Wait, the problem says: ""When T rests on the outside of S, it is externally tangent to S along a circle with radius r_i, and when T rests on the outside of S, it is externally tangent to S along a circle with radius r_o."" Wait, that seems redundant.","The model experiences an assumption drift by questioning the redundancy of the problem statement, which leads to a momentary uncertainty in the active assumption before recovering.",assumption_drift|repair_without_recovery,2,0,1,0,0,0,1
math,aime24,88,aime24:88,59,0,1,15618,91333,yes,2.0,assumption_tracking,case_analysis,1.0,recovered_break,yes,medium,"Wait, maybe the torus is resting on the sphere such that there are two points of tangency? Or perhaps the torus is tangent to the sphere along two different circles? Maybe one circle is where the inner part of the torus touches the sphere, and another where the outer part touches? But since the torus is symmetric, maybe there are two circles of contact? Hmm.","The model drifts from the initial assumption of a single point of tangency to considering multiple points of tangency without a clear resolution, leading to an assumption drift. This is later corrected, but it indicates an instability in the active assumption.",assumption_drift|repair_without_recovery,accepted_math,yes,1,2,assumption_tracking,case_analysis,1.0,recovered_break,yes,medium,"Wait, maybe the torus is resting on the sphere such that there are two points of tangency? Or perhaps the torus is tangent to the sphere along two different circles? Maybe one circle is where the inner part of the torus touches the sphere, and another where the outer part touches? But since the torus is symmetric, maybe there are two circles of contact? Hmm.","The model drifts from the initial assumption of a single point of tangency to considering multiple points of tangency without a clear resolution, leading to an assumption drift. This is later corrected, but it indicates an instability in the active assumption.",assumption_drift|repair_without_recovery,2,0,1,0,0,0,1
math,aime24,89,aime24:89,4,0,1,15620,41679,yes,2.0,assumption_tracking,case_analysis,1.0,recovered_break,yes,medium,"Therefore, the only way to have a consistent configuration is if all rows are the same color, or all columns are the same color. Wait, this seems to circle back to the previous conclusion. Let me try again.","The model drifts from the assumption that rows and columns can be of different colors to the assumption that they must be the same, without a clear explanation or correction of the initial assumption.",assumption_drift|repair_without_recovery,accepted_math,yes,1,2,assumption_tracking,case_analysis,1.0,recovered_break,yes,medium,"Therefore, the only way to have a consistent configuration is if all rows are the same color, or all columns are the same color. Wait, this seems to circle back to the previous conclusion. Let me try again.","The model drifts from the assumption that rows and columns can be of different colors to the assumption that they must be the same, without a clear explanation or correction of the initial assumption.",assumption_drift|repair_without_recovery,2,0,1,0,0,0,1
math,aime24,89,aime24:89,17,1,1,15617,84135,yes,2.0,assumption_tracking,symbolic_manipulation,1.0,recovered_break,yes,medium,"Therefore, the configuration is maximal. But that's not maximal, since we can add chips. Therefore, we need to exclude configurations where both r = 0 and c = 0.","The model initially assumes the configuration is maximal, but later realizes it is not, leading to a need to exclude certain configurations. This creates an assumption drift and requires a repair without recovery.",assumption_drift|repair_without_recovery,accepted_math,yes,1,2,assumption_tracking,symbolic_manipulation,1.0,recovered_break,yes,medium,"Therefore, the configuration is maximal. But that's not maximal, since we can add chips. Therefore, we need to exclude configurations where both r = 0 and c = 0.","The model initially assumes the configuration is maximal, but later realizes it is not, leading to a need to exclude certain configurations. This creates an assumption drift and requires a repair without recovery.",assumption_drift|repair_without_recovery,2,0,1,0,0,0,1
math,aime24,89,aime24:89,33,1,1,15619,118866,yes,2.0,assumption_tracking,case_analysis,1.0,recovered_break,yes,medium,"Therefore, the placement must be such that every row and every column is either entirely filled with chips of one color or entirely empty? Wait, no. Wait, the first two conditions say that all chips in the same row have the same color, and same for columns. So, for example, if a row has some chips, they must all be the same color. Similarly, if a column has some chips, they must all be the same color. But then, the third condition says that you can't add any more chips. So, if a row has some chips, then adding another chip to that row would have to be of the same color, but maybe the column that it's placed in already has chips of a different color? Wait, no. Let me think.","The model's reasoning becomes unstable when trying to reconcile the conditions for placing chips on the grid. The initial assumption about the placement of chips is later contradicted, leading to a need for reevaluation.",assumption_drift|repair_without_recovery,accepted_math,yes,1,2,assumption_tracking,case_analysis,1.0,recovered_break,yes,medium,"Therefore, the placement must be such that every row and every column is either entirely filled with chips of one color or entirely empty? Wait, no. Wait, the first two conditions say that all chips in the same row have the same color, and same for columns. So, for example, if a row has some chips, they must all be the same color. Similarly, if a column has some chips, they must all be the same color. But then, the third condition says that you can't add any more chips. So, if a row has some chips, then adding another chip to that row would have to be of the same color, but maybe the column that it's placed in already has chips of a different color? Wait, no. Let me think.","The model's reasoning becomes unstable when trying to reconcile the conditions for placing chips on the grid. The initial assumption about the placement of chips is later contradicted, leading to a need for reevaluation.",assumption_drift|repair_without_recovery,2,0,1,0,0,0,1
math,aime24,89,aime24:89,39,0,1,15620,59420,yes,2.0,assumption_tracking,case_analysis,2.0,recovered_break,yes,medium,"Therefore, this seems to imply that the entire grid is partitioned into regions where each region is a set of rows and columns with the same color. Wait, maybe not.","The model's reasoning becomes unstable when considering the partitioning of the grid into regions with the same color. This assumption is later revised, but the reasoning process is not immediately corrected, leading to a moderate break in the active state.",assumption_drift|repair_without_recovery,accepted_math,yes,1,2,assumption_tracking,case_analysis,2.0,recovered_break,yes,medium,"Therefore, this seems to imply that the entire grid is partitioned into regions where each region is a set of rows and columns with the same color. Wait, maybe not.","The model's reasoning becomes unstable when considering the partitioning of the grid into regions with the same color. This assumption is later revised, but the reasoning process is not immediately corrected, leading to a moderate break in the active state.",assumption_drift|repair_without_recovery,2,0,1,0,0,0,1
math,aime25,10,aime25:10,20,0,1,15619,69493,yes,1.0,symbol_binding,symbolic_manipulation,0.0,recovered_break,yes,medium,"Now, the graph repeats every 4 units. So from x=-1 to x=3, and then from x=3 to x=7, it should be the same as from x=-1 to x=3.","The model incorrectly assumes that the function repeats identically from x=3 to x=7, when in fact it should be considered as part of the next period starting at x=7.",variable_binding_drift,accepted_math,yes,1,1,symbol_binding,symbolic_manipulation,0.0,recovered_break,yes,medium,"Now, the graph repeats every 4 units. So from x=-1 to x=3, and then from x=3 to x=7, it should be the same as from x=-1 to x=3.","The model incorrectly assumes that the function repeats identically from x=3 to x=7, when in fact it should be considered as part of the next period starting at x=7.",variable_binding_drift,1,0,0,0,1,0,0
math,aime25,10,aime25:10,24,1,1,15619,61648,no,0.0,none,symbolic_manipulation,0.0,stable,no,high,,"The reasoning provided is consistent and maintains a stable control over the active assumptions, cases, symbols, subgoals, and invariants throughout the trace.",none,raw_no,no,0,0,none,symbolic_manipulation,0.0,stable,no,high,,"The reasoning provided is consistent and maintains a stable control over the active assumptions, cases, symbols, subgoals, and invariants throughout the trace.",none,0,0,0,0,0,0,0
math,aime25,10,aime25:10,28,1,1,15617,63685,no,0.0,none,symbolic_manipulation,0.0,stable,no,high,,"The reasoning provided is consistent and maintains a stable control over the active assumptions, cases, symbols, subgoals, and invariants throughout the trace.",none,raw_no,no,0,0,none,symbolic_manipulation,0.0,stable,no,high,,"The reasoning provided is consistent and maintains a stable control over the active assumptions, cases, symbols, subgoals, and invariants throughout the trace.",none,0,0,0,0,0,0,0
math,aime25,10,aime25:10,44,0,1,15617,73414,yes,2.0,symbol_binding,symbolic_manipulation,1.0,recovered_break,yes,medium,"Now, for y solving 34y^2 + y - 2 = 0, so y = [-1 ± sqrt(1+4*34*2)]/68? For m=0, second equation is 34y^2 + y - 2 = 0, yes D=1+272=273, as before.","The model drifts in variable binding, solving for y without considering the context of m, leading to a repair without recovery. The state is later corrected.",variable_binding_drift|repair_without_recovery,accepted_math,yes,1,2,symbol_binding,symbolic_manipulation,1.0,recovered_break,yes,medium,"Now, for y solving 34y^2 + y - 2 = 0, so y = [-1 ± sqrt(1+4*34*2)]/68? For m=0, second equation is 34y^2 + y - 2 = 0, yes D=1+272=273, as before.","The model drifts in variable binding, solving for y without considering the context of m, leading to a repair without recovery. The state is later corrected.",variable_binding_drift|repair_without_recovery,2,0,0,0,1,0,1
math,aime25,11,aime25:11,23,0,1,15618,86082,yes,2.0,symbol_binding,symbolic_manipulation,1.0,recovered_break,yes,medium,"The four lines intersect at six points: (-1,-1), (38,38), (25,25), (-1,77), (77,-1), (-1,38)",The model incorrectly assumes that the intersection points are vertices of the regions without considering the inequalities. It later corrects this by considering the inequalities but does not immediately resolve the confusion caused by the initial assumption.,variable_binding_drift|repair_without_recovery,accepted_math,yes,1,2,symbol_binding,symbolic_manipulation,1.0,recovered_break,yes,medium,"The four lines intersect at six points: (-1,-1), (38,38), (25,25), (-1,77), (77,-1), (-1,38)",The model incorrectly assumes that the intersection points are vertices of the regions without considering the inequalities. It later corrects this by considering the inequalities but does not immediately resolve the confusion caused by the initial assumption.,variable_binding_drift|repair_without_recovery,2,0,0,0,1,0,1
math,aime25,11,aime25:11,24,1,1,15619,73645,no,0.0,none,symbolic_manipulation,0.0,stable,no,high,,"The reasoning provided is consistent and maintains a stable control of the active assumptions, cases, symbols, subgoals, and invariants throughout the trace.",none,raw_no,no,0,0,none,symbolic_manipulation,0.0,stable,no,high,,"The reasoning provided is consistent and maintains a stable control of the active assumptions, cases, symbols, subgoals, and invariants throughout the trace.",none,0,0,0,0,0,0,0
math,aime25,11,aime25:11,46,1,1,15620,82366,yes,2.0,symbol_binding,symbolic_manipulation,1.0,recovered_break,yes,medium,"Now, the region is defined by x+y<76, x<y, x>-1, x+2y<75, but as we simplified earlier, it is equivalent to -1 < y < 38, and for each y, x > -1, x < min(y, 75-2y)","The model drifts from the original variable bindings and attempts to simplify the inequalities, leading to a temporary loss of clarity in the variable relationships.",variable_binding_drift|repair_without_recovery,accepted_math,yes,1,2,symbol_binding,symbolic_manipulation,1.0,recovered_break,yes,medium,"Now, the region is defined by x+y<76, x<y, x>-1, x+2y<75, but as we simplified earlier, it is equivalent to -1 < y < 38, and for each y, x > -1, x < min(y, 75-2y)","The model drifts from the original variable bindings and attempts to simplify the inequalities, leading to a temporary loss of clarity in the variable relationships.",variable_binding_drift|repair_without_recovery,2,0,0,0,1,0,1
