domain,dataset,problem_id,problem_key,run_index,is_correct,parse_ok,think_chars,think_total_chars,raw_knot_present,raw_knot_severity,raw_primary_trigger,raw_trace_strategy,raw_reversal_count,raw_state_consistency,raw_recovers_later,raw_annotator_confidence,raw_knot_quote,raw_open_diagnosis,raw_knot_symptoms,protocol_filter,knot_present,knot_present_bin,knot_severity,primary_trigger,trace_strategy,reversal_count,state_consistency,recovers_later,annotator_confidence,knot_quote,open_diagnosis,knot_symptoms,knot_count,sym_case_split_instability,sym_assumption_drift,sym_subgoal_frame_loss,sym_variable_binding_drift,sym_invariant_drift,sym_repair_without_recovery
math,aime24,64,aime24:64,20,1,1,15619,24744,no,0.0,none,symbolic_manipulation,0.0,stable,no,high,,The reasoning is consistent and follows a logical path without any breaks in control.,none,raw_no,no,0,0,none,symbolic_manipulation,0.0,stable,no,high,,The reasoning is consistent and follows a logical path without any breaks in control.,none,0,0,0,0,0,0,0
math,aime24,64,aime24:64,38,0,1,15619,29820,no,0.0,none,symbolic_manipulation,0.0,stable,no,high,,The reasoning is consistent and follows a logical progression without any breaks in the active state.,none,raw_no,no,0,0,none,symbolic_manipulation,0.0,stable,no,high,,The reasoning is consistent and follows a logical progression without any breaks in the active state.,none,0,0,0,0,0,0,0
math,aime24,64,aime24:64,53,1,1,15621,22969,no,0.0,none,symbolic_manipulation,0.0,stable,no,high,,"The reasoning provided is consistent and maintains a stable control of the active assumptions, cases, symbols, subgoals, and invariants throughout the trace.",none,raw_no,no,0,0,none,symbolic_manipulation,0.0,stable,no,high,,"The reasoning provided is consistent and maintains a stable control of the active assumptions, cases, symbols, subgoals, and invariants throughout the trace.",none,0,0,0,0,0,0,0
math,aime24,64,aime24:64,54,0,1,15618,40620,no,0.0,none,symbolic_manipulation,0.0,stable,no,high,,The reasoning provided is consistent and maintains a stable control over the active assumptions and subgoals throughout the trace.,none,raw_no,no,0,0,none,symbolic_manipulation,0.0,stable,no,high,,The reasoning provided is consistent and maintains a stable control over the active assumptions and subgoals throughout the trace.,none,0,0,0,0,0,0,0
math,aime24,66,aime24:66,20,1,1,15619,32048,yes,2.0,case_split,symbolic_manipulation,1.0,recovered_break,yes,medium,"Therefore, the maximum value of S is 9.75, which is 39/4. Wait, 9.75 is 9 + 3/4 = 39/4? Wait 9.75 = 9 + 0.75 = 9 + 3/4 = 39/4? Wait 9*4 = 36, 36 + 3 = 39. Yes, 39/4 = 9.75. So, S = 39/4.","The model initially presents a calculation for the maximum value of S, but then questions its own result, leading to a temporary confusion in the active state. The confusion is later resolved, but it indicates a momentary loss of control over the calculation.",case_split_instability|repair_without_recovery,accepted_math,yes,1,2,case_split,symbolic_manipulation,1.0,recovered_break,yes,medium,"Therefore, the maximum value of S is 9.75, which is 39/4. Wait, 9.75 is 9 + 3/4 = 39/4? Wait 9.75 = 9 + 0.75 = 9 + 3/4 = 39/4? Wait 9*4 = 36, 36 + 3 = 39. Yes, 39/4 = 9.75. So, S = 39/4.","The model initially presents a calculation for the maximum value of S, but then questions its own result, leading to a temporary confusion in the active state. The confusion is later resolved, but it indicates a momentary loss of control over the calculation.",case_split_instability|repair_without_recovery,2,1,0,0,0,0,1
math,aime24,66,aime24:66,24,0,1,15620,57229,yes,3.0,repair_loop,symbolic_manipulation,1.0,lost_state,no,high,"This was a critical mistake! I misread the problem. Let me re-express: The problem says: 'the smallest sphere that can contain each of the rectangular boxes that are elements of 𝒞.' So, it's the smallest sphere that contains all boxes in 𝒞. Therefore, the radius r is the smallest such that every box in 𝒞 fits inside the sphere...","The model misinterpreted the problem, leading to a loss of the correct state and an inability to recover.",repair_without_recovery|invariant_drift,accepted_math,yes,1,3,repair_loop,symbolic_manipulation,1.0,lost_state,no,high,"This was a critical mistake! I misread the problem. Let me re-express: The problem says: 'the smallest sphere that can contain each of the rectangular boxes that are elements of 𝒞.' So, it's the smallest sphere that contains all boxes in 𝒞. Therefore, the radius r is the smallest such that every box in 𝒞 fits inside the sphere...","The model misinterpreted the problem, leading to a loss of the correct state and an inability to recover.",repair_without_recovery|invariant_drift,2,0,0,0,0,1,1
math,aime24,66,aime24:66,27,1,0,15618,22462,,,,,,,,,,,none,raw_no,no,0,0,none,,,,,,,,none,0,0,0,0,0,0,0
math,aime24,66,aime24:66,39,0,0,15620,35153,,,,,,,,,,,none,raw_no,no,0,0,none,,,,,,,,none,0,0,0,0,0,0,0
math,aime24,68,aime24:68,30,1,1,15618,27952,no,0.0,none,symbolic_manipulation,0.0,stable,no,high,,The reasoning provided is consistent and maintains a stable control of the active assumptions and invariants throughout.,none,raw_no,no,0,0,none,symbolic_manipulation,0.0,stable,no,high,,The reasoning provided is consistent and maintains a stable control of the active assumptions and invariants throughout.,none,0,0,0,0,0,0,0
math,aime24,68,aime24:68,38,0,1,15619,72796,yes,2.0,assumption_tracking,symbolic_manipulation,1.0,recovered_break,yes,medium,"Wait, no. Wait, if you are at n=2, and you take 1 token, leaving n=1 for the opponent. Then the opponent can take the last token and win. Therefore, if you are at n=2, you have no winning moves. Therefore, n=2 is a losing position? Wait, but let me check again.","The model drifts from the assumption that n=2 is a losing position and attempts to correct it, but the correction is not immediately clear, leading to a momentary instability in the active assumption.",assumption_drift|repair_without_recovery,accepted_math,yes,1,2,assumption_tracking,symbolic_manipulation,1.0,recovered_break,yes,medium,"Wait, no. Wait, if you are at n=2, and you take 1 token, leaving n=1 for the opponent. Then the opponent can take the last token and win. Therefore, if you are at n=2, you have no winning moves. Therefore, n=2 is a losing position? Wait, but let me check again.","The model drifts from the assumption that n=2 is a losing position and attempts to correct it, but the correction is not immediately clear, leading to a momentary instability in the active assumption.",assumption_drift|repair_without_recovery,2,0,1,0,0,0,1
math,aime24,68,aime24:68,43,1,1,15620,25050,yes,2.0,assumption_tracking,symbolic_manipulation,2.0,recovered_break,yes,medium,"L(n) is true if both L(n-1) and L(n-4) are false. Wait, no. Wait: If there exists a move that leads to a losing position for the opponent, then current position is winning. Therefore, L(n) is true (losing) only if all possible moves lead to a winning position for the opponent.","The model initially establishes an assumption about the nature of winning and losing positions, but then revises this assumption without clearly communicating the change, leading to confusion and a need for later correction.",assumption_drift|repair_without_recovery,accepted_math,yes,1,2,assumption_tracking,symbolic_manipulation,2.0,recovered_break,yes,medium,"L(n) is true if both L(n-1) and L(n-4) are false. Wait, no. Wait: If there exists a move that leads to a losing position for the opponent, then current position is winning. Therefore, L(n) is true (losing) only if all possible moves lead to a winning position for the opponent.","The model initially establishes an assumption about the nature of winning and losing positions, but then revises this assumption without clearly communicating the change, leading to confusion and a need for later correction.",assumption_drift|repair_without_recovery,2,0,1,0,0,0,1
math,aime24,68,aime24:68,55,1,1,15620,19270,no,0.0,none,symbolic_manipulation,0.0,stable,no,high,,The reasoning is consistent and follows a logical progression without any breaks in the active state.,none,raw_no,no,0,0,none,symbolic_manipulation,0.0,stable,no,high,,The reasoning is consistent and follows a logical progression without any breaks in the active state.,none,0,0,0,0,0,0,0
math,aime24,70,aime24:70,5,0,1,15619,80364,yes,2.0,symbol_binding,symbolic_manipulation,1.0,recovered_break,yes,medium,"Let me place rectangle ABCD such that point D is at the origin (0, 0). Since ABCD is a rectangle, moving from D to C would be along the x-axis, and from D to A would be along the y-axis. Wait, but BC is 16. Let me think again.",The model attempted to assign coordinates to the rectangle ABCD but encountered an inconsistency in the placement of points due to the given dimensions. This led to a variable binding drift and a need for repair without recovery.,variable_binding_drift|repair_without_recovery,accepted_math,yes,1,2,symbol_binding,symbolic_manipulation,1.0,recovered_break,yes,medium,"Let me place rectangle ABCD such that point D is at the origin (0, 0). Since ABCD is a rectangle, moving from D to C would be along the x-axis, and from D to A would be along the y-axis. Wait, but BC is 16. Let me think again.",The model attempted to assign coordinates to the rectangle ABCD but encountered an inconsistency in the placement of points due to the given dimensions. This led to a variable binding drift and a need for repair without recovery.,variable_binding_drift|repair_without_recovery,2,0,0,0,1,0,1
math,aime24,70,aime24:70,7,1,1,15620,28561,yes,2.0,symbol_binding,symbolic_manipulation,1.0,recovered_break,yes,medium,"Let me take point A at (0, 0). Then, since AB = 107, if AB is horizontal, then point B is at (107, 0). Then BC = 16, so moving up from B, since BC is vertical, point C would be at (107, 16). Then point D would be at (0, 16), completing the rectangle. Wait, but then DC would be from D(0,16) to C(107,16), so DC is 107 units, which is equal to AB. And AD is from A(0,0) to D(0,16), which is 16 units, equal to BC. That works. So in this case, rectangle ABCD has coordinates A(0,0), B(107,0), C(107,16), D(0,16).","The model initially assigns coordinates to points A, B, C, and D based on the given lengths of AB and BC. However, it fails to recognize that the coordinates for B and C are not consistent with the rectangle's properties, leading to a variable binding drift. The model later corrects this by realizing that the coordinates must be consistent with the rectangle's properties, but this correction is not immediately clear from the text.",variable_binding_drift|repair_without_recovery,accepted_math,yes,1,2,symbol_binding,symbolic_manipulation,1.0,recovered_break,yes,medium,"Let me take point A at (0, 0). Then, since AB = 107, if AB is horizontal, then point B is at (107, 0). Then BC = 16, so moving up from B, since BC is vertical, point C would be at (107, 16). Then point D would be at (0, 16), completing the rectangle. Wait, but then DC would be from D(0,16) to C(107,16), so DC is 107 units, which is equal to AB. And AD is from A(0,0) to D(0,16), which is 16 units, equal to BC. That works. So in this case, rectangle ABCD has coordinates A(0,0), B(107,0), C(107,16), D(0,16).","The model initially assigns coordinates to points A, B, C, and D based on the given lengths of AB and BC. However, it fails to recognize that the coordinates for B and C are not consistent with the rectangle's properties, leading to a variable binding drift. The model later corrects this by realizing that the coordinates must be consistent with the rectangle's properties, but this correction is not immediately clear from the text.",variable_binding_drift|repair_without_recovery,2,0,0,0,1,0,1
math,aime24,70,aime24:70,53,1,1,15616,30551,yes,2.0,symbol_binding,symbolic_manipulation,1.0,recovered_break,yes,medium,"Let me denote coordinates:
Let me assume that D is at (0, 0). Then, since ABCD is a rectangle, and if DC is along the x-axis, then point C would be at (c, 0) for some c. Then, since AB = 107 and BC = 16, the rectangle ABCD would have sides AB and BC. Wait, if DC is along the x-axis from D(0,0) to C(c, 0), then AD is vertical. So point A would be at (0, y) and point B at (c, y), but then AB would be horizontal? Wait, maybe I need to think more carefully.","The model struggles with assigning coordinates to points in a rectangle, leading to confusion about the orientation and dimensions of the rectangle. This confusion is not immediately resolved, but the model eventually corrects the mistake.",variable_binding_drift|repair_without_recovery,accepted_math,yes,1,2,symbol_binding,symbolic_manipulation,1.0,recovered_break,yes,medium,"Let me denote coordinates:
Let me assume that D is at (0, 0). Then, since ABCD is a rectangle, and if DC is along the x-axis, then point C would be at (c, 0) for some c. Then, since AB = 107 and BC = 16, the rectangle ABCD would have sides AB and BC. Wait, if DC is along the x-axis from D(0,0) to C(c, 0), then AD is vertical. So point A would be at (0, y) and point B at (c, y), but then AB would be horizontal? Wait, maybe I need to think more carefully.","The model struggles with assigning coordinates to points in a rectangle, leading to confusion about the orientation and dimensions of the rectangle. This confusion is not immediately resolved, but the model eventually corrects the mistake.",variable_binding_drift|repair_without_recovery,2,0,0,0,1,0,1
math,aime24,70,aime24:70,55,0,1,15619,68717,yes,2.0,symbol_binding,symbolic_manipulation,1.0,recovered_break,yes,medium,"Let me denote x = CE = |107 - e|. If E is to the left of D, then e = -x + 107? Wait, no. If CE = |107 - e|, and if E is to the left of D (which is at 0), then e is negative, so CE = 107 - e. Let me write e = -k, where k > 0. Then CE = 107 + k. But maybe not helpful.","The model initially introduces a variable x to represent CE and e to represent the distance from D to E. However, it later revises the definition of x to represent CE and e to represent the distance from D to E in a different way, leading to confusion and a need for a repair. The repair is not immediately clear and leads to a temporary loss of state consistency.",variable_binding_drift|repair_without_recovery,setup_search,no,0,0,none,symbolic_manipulation,1.0,recovered_break,yes,medium,"Let me denote x = CE = |107 - e|. If E is to the left of D, then e = -x + 107? Wait, no. If CE = |107 - e|, and if E is to the left of D (which is at 0), then e is negative, so CE = 107 - e. Let me write e = -k, where k > 0. Then CE = 107 + k. But maybe not helpful.","The model initially introduces a variable x to represent CE and e to represent the distance from D to E. However, it later revises the definition of x to represent CE and e to represent the distance from D to E in a different way, leading to confusion and a need for a repair. The repair is not immediately clear and leads to a temporary loss of state consistency.",none,0,0,0,0,0,0,0
math,aime24,73,aime24:73,31,0,1,15620,77947,yes,2.0,assumption_tracking,symbolic_manipulation,1.0,recovered_break,yes,medium,"The key here is probably the concept of circles tangent to two sides of a triangle, which relates to the inradius and maybe some other radii. But there are eight circles of radius 34 and 2024 circles of radius 1 arranged in the same manner. The inradius of triangle ABC is to be found as a fraction m/n, and then compute m + n.",The model starts by making assumptions about the relationship between the circles and the inradius without fully establishing a clear connection. This leads to a lack of direction in the problem-solving process.,assumption_drift|repair_without_recovery,accepted_math,yes,1,2,assumption_tracking,symbolic_manipulation,1.0,recovered_break,yes,medium,"The key here is probably the concept of circles tangent to two sides of a triangle, which relates to the inradius and maybe some other radii. But there are eight circles of radius 34 and 2024 circles of radius 1 arranged in the same manner. The inradius of triangle ABC is to be found as a fraction m/n, and then compute m + n.",The model starts by making assumptions about the relationship between the circles and the inradius without fully establishing a clear connection. This leads to a lack of direction in the problem-solving process.,assumption_drift|repair_without_recovery,2,0,1,0,0,0,1
math,aime24,73,aime24:73,40,0,1,15620,59107,yes,2.0,assumption_tracking,symbolic_manipulation,1.0,recovered_break,yes,medium,"Wait, the problem mentions that there are eight circles of radius 34 and 2024 circles of radius 1 arranged in the same manner. So maybe there's a formula that relates the number of circles to the radius, and we can use that to find the inradius?","The model drifts from the initial assumption that the number of circles and their radii are directly related to the inradius, which is later corrected but leads to confusion.",assumption_drift|repair_without_recovery,accepted_math,yes,1,2,assumption_tracking,symbolic_manipulation,1.0,recovered_break,yes,medium,"Wait, the problem mentions that there are eight circles of radius 34 and 2024 circles of radius 1 arranged in the same manner. So maybe there's a formula that relates the number of circles to the radius, and we can use that to find the inradius?","The model drifts from the initial assumption that the number of circles and their radii are directly related to the inradius, which is later corrected but leads to confusion.",assumption_drift|repair_without_recovery,2,0,1,0,0,0,1
math,aime24,73,aime24:73,44,1,1,15617,41665,yes,2.0,assumption_tracking,case_analysis,1.0,recovered_break,yes,medium,"Wait, the problem says ""sequentially tangent,"" so maybe they are arranged in a straight line, each tangent to the previous one and to the sides? Hmm. Alternatively, maybe they are arranged in a way similar to the incircle or an Apollonius circle?","The model drifts between different assumptions about the arrangement of the circles without settling on one, leading to an unstable state that is later corrected.",assumption_drift|repair_without_recovery,accepted_math,yes,1,2,assumption_tracking,case_analysis,1.0,recovered_break,yes,medium,"Wait, the problem says ""sequentially tangent,"" so maybe they are arranged in a straight line, each tangent to the previous one and to the sides? Hmm. Alternatively, maybe they are arranged in a way similar to the incircle or an Apollonius circle?","The model drifts between different assumptions about the arrangement of the circles without settling on one, leading to an unstable state that is later corrected.",assumption_drift|repair_without_recovery,2,0,1,0,0,0,1
math,aime24,73,aime24:73,62,1,1,15618,43904,yes,2.0,assumption_tracking,symbolic_manipulation,1.0,recovered_break,yes,medium,"Wait, maybe the triangle ABC has an incircle, and then there are circles packed in the corners? But the problem mentions eight circles of radius 34 and 2024 of radius 1 arranged in the same manner. So maybe the same configuration is used for both, with different numbers of circles and radii.","The model drifts from the initial assumption about the configuration of the circles and the triangle, leading to a series of repairs without a clear resolution.",assumption_drift|repair_without_recovery,accepted_math,yes,1,2,assumption_tracking,symbolic_manipulation,1.0,recovered_break,yes,medium,"Wait, maybe the triangle ABC has an incircle, and then there are circles packed in the corners? But the problem mentions eight circles of radius 34 and 2024 of radius 1 arranged in the same manner. So maybe the same configuration is used for both, with different numbers of circles and radii.","The model drifts from the initial assumption about the configuration of the circles and the triangle, leading to a series of repairs without a clear resolution.",assumption_drift|repair_without_recovery,2,0,1,0,0,0,1
math,aime24,75,aime24:75,8,1,1,15619,20990,yes,2.0,assumption_tracking,symbolic_manipulation,1.0,recovered_break,yes,medium,"Wait, the problem says 'own exactly two of these things' and 'own exactly three of these things'. So, the 'these things' refers to the four items: diamond ring, golf clubs, garden spade, and candy hearts. But since everyone has candy hearts, owning exactly two of these things would mean owning candy hearts plus one other, or two of the other items? Wait, but if everyone owns candy hearts, then if someone owns exactly two of these things, they must be owning candy hearts and one other item. Because if they didn't own candy hearts, they wouldn't be counted as residents?","The model drifts from the assumption that owning exactly two items includes candy hearts, which is a given for all residents, to considering the possibility that owning exactly two items does not include candy hearts. This leads to a confusion in the reasoning, but the model later corrects this assumption and continues with the correct understanding.",assumption_drift|repair_without_recovery,accepted_math,yes,1,2,assumption_tracking,symbolic_manipulation,1.0,recovered_break,yes,medium,"Wait, the problem says 'own exactly two of these things' and 'own exactly three of these things'. So, the 'these things' refers to the four items: diamond ring, golf clubs, garden spade, and candy hearts. But since everyone has candy hearts, owning exactly two of these things would mean owning candy hearts plus one other, or two of the other items? Wait, but if everyone owns candy hearts, then if someone owns exactly two of these things, they must be owning candy hearts and one other item. Because if they didn't own candy hearts, they wouldn't be counted as residents?","The model drifts from the assumption that owning exactly two items includes candy hearts, which is a given for all residents, to considering the possibility that owning exactly two items does not include candy hearts. This leads to a confusion in the reasoning, but the model later corrects this assumption and continues with the correct understanding.",assumption_drift|repair_without_recovery,2,0,1,0,0,0,1
math,aime24,75,aime24:75,12,0,1,15620,29967,yes,2.0,assumption_tracking,case_analysis,1.0,recovered_break,yes,medium,"Wait, but the problem says 'each of the 900 residents owns a bag of candy hearts.' So, the four things are: diamond ring, golf clubs, garden spade, and candy hearts. But the problem says 'each of the 900 residents owns a bag of candy hearts.' So, that means that everyone has the candy hearts. Therefore, when they talk about owning exactly two of these things, does that mean two of the four? But since everyone has the candy hearts, then if someone owns exactly two things, they must own the candy hearts and one of the other three? Wait, but that seems conflicting with the numbers given. Let me think again.","The model's reasoning becomes unstable when it assumes that owning exactly two of the four items means owning the candy hearts and one other item, which conflicts with the given numbers. This assumption is not immediately corrected, leading to confusion and a need for further clarification.",assumption_drift|repair_without_recovery,accepted_math,yes,1,2,assumption_tracking,case_analysis,1.0,recovered_break,yes,medium,"Wait, but the problem says 'each of the 900 residents owns a bag of candy hearts.' So, the four things are: diamond ring, golf clubs, garden spade, and candy hearts. But the problem says 'each of the 900 residents owns a bag of candy hearts.' So, that means that everyone has the candy hearts. Therefore, when they talk about owning exactly two of these things, does that mean two of the four? But since everyone has the candy hearts, then if someone owns exactly two things, they must own the candy hearts and one of the other three? Wait, but that seems conflicting with the numbers given. Let me think again.","The model's reasoning becomes unstable when it assumes that owning exactly two of the four items means owning the candy hearts and one other item, which conflicts with the given numbers. This assumption is not immediately corrected, leading to confusion and a need for further clarification.",assumption_drift|repair_without_recovery,2,0,1,0,0,0,1
math,aime24,75,aime24:75,39,0,1,15619,33264,yes,2.0,variable_binding_drift,symbolic_manipulation,1.0,recovered_break,yes,medium,"Wait, this is getting complicated. Let me formalize it.","The model struggles with maintaining consistent variable bindings and assumptions, leading to confusion and a need for reevaluation of the problem setup.",assumption_drift|variable_binding_drift,accepted_math,yes,1,2,variable_binding_drift,symbolic_manipulation,1.0,recovered_break,yes,medium,"Wait, this is getting complicated. Let me formalize it.","The model struggles with maintaining consistent variable bindings and assumptions, leading to confusion and a need for reevaluation of the problem setup.",assumption_drift|variable_binding_drift,2,0,1,0,1,0,0
